Title,Features,Guide,Total_Value,Status,Platform,Requirements,Num_Of_Prev_Drops,Website,Ticker,Total_Supply,Whitepaper,Thumbnail,Facebook,Telegram Group,Telegram Channel,Discord,Twitter,Medium,CoinGecko,GitHub,Coinmarketcap,Reddit,Exchanges,Youtube
ClayStack,"ClayStack is a pioneering liquid staking protocol designed for the Ethereum ecosystem. Their mission is to lead a new era in the global staking industry, with the aim of bringing staking into the mainstream. Our unique approach, anchored in our commitment to decentralization, security, scalability, and inclusivity, sets us apart. csETH, a key part of our platform, enhances the security of Ethereum and DeFi by fostering active participation and promoting scalable, robust staking.","['1. Visit the ClasyStack website.', '2. Connect your wallet.', '3. You will need ETH, rETH or stETH. You can get ETH from Binance.', '4. Now stake ETH on ClayStack.', '5. You will get csETH.', '6. Now, you will start earning CLAY points as well as EigenLayer points.', '7. A total of 5% of the total supply of CLAY tokens has been allocated for this airdrop.', '8. The CLAY points you earn will be converted to CLAY tokens at a 1:1 ratio at TGE.', '9. You could also become eligible for the EigenLayer speculative airdrop for earning EigenLayer points.', '10. Also, earn 10% of the CLAY points from each referral.']",5% of the total supply,Expired,eth,n/a,0,https://claystack.com/,CLAY,"100,000,000 CLAY",https://airdrops.io/visit/iam2/,https://airdrops.io/wp-content/uploads/2024/02/ClayStack-logo.png,n/a,https://t.me/claystack,n/a,https://airdrops.io/visit/jam2/,https://twitter.com/ClayStack_HQ,n/a,n/a,n/a,n/a,n/a,n/a,n/a
Retro Bridge,"RetroBridge is an advanced cross-chain bridging solution designed to streamline the process of transferring assets across different blockchain networks. Their approach utilises concentrated liquidity pools within their dedicated address storages on each blockchain. This innovative strategy enables them to bypass the traditional reliance on smart contracts, a move that significantly enhances efficiency and cost-effectiveness.","['1. Visit the Retro Bridge “Sunrise” campaign page.', '2. Connect your wallet.', '3. Follow them on Twitter.', '4. Do an ETH and stablecoin (USDT/USDC) bridge between any EVM-compatible networks.', '5. If you don’t already have ETH, USDT, or USDC, you can get them from Binance.', '6. Also, retweet this tweet.', '7. Now, you will be able to claim the Retro Bridge Sunrise NFT.', '8. Sunrise NFT allows you to bridge across all EVM networks for a flat fee of $1.75.', '9. Also, join their Discord and complete the Galxe quests.', '10. Continue using the bridge even after claiming the NFT.', '11. There are three more phases coming up where you will have the opportunity to claim additional NFTs. So make sure to stay active and keep an eye on their socials.', '12. They also don’t have their own token yet but have hinted at possible token in their FAQ section.', '13. Please note that there is no guarantee that they will do an airdrop and that they will launch their own token. It’s only speculation.']",n/a,Airdrop Unconfirmed,eth,n/a,0,https://retrobridge.io/,N/A,n/a,https://airdrops.io/visit/59m2/,https://airdrops.io/wp-content/uploads/2024/02/Retro-Bridge-logo.jpg,n/a,n/a,n/a,https://airdrops.io/visit/69m2/,https://twitter.com/retro_bridge,n/a,n/a,https://github.com/retro-bridge,n/a,n/a,n/a,n/a
INIT Capital,"INIT Capital aims to democratize access to liquidity, catering not only to DeFi users but also to protocols through 'Liquidity Hooks.' Liquidity Hooks serve as plugins for liquidity. DApps developing strategies such as all kinds of vaults, leveraged LP/Farming, perpetual trading, margin trading, LSTFi, etc., can easily build Liquidity Hooks by writing their smart contracts to integrate or 'hook' onto INIT and access INIT’s liquidity in a permissionless manner. With that, dApps can fully concentrate on catering yield strategies or 'Hooks' for end-users.","['1. Visit the INIT Capital website.', '2. Connect your wallet and change the network to Mantle.', '3. Now click on “Join the Campaign”.', '4. Follow them on Twitter, join their Discord channel, and verify.', '5. You have now joined the campaign.', '6. You will need some ETH and/or other tokens on the Mantle network. You can get them from Binance.', '7. Now, use the Mantle bridge to bridge tokens from Ethereum Mainnet to Mantle. You will also get some free Mantle (MNT) to cover gas fees.', '8. Now, deposit or borrow tokens to start earning points.', '9. You will earn 1 INIT point for every $100 value lent per day and 7 INIT points for every $100 value borrowed per day.', '10. Also, refer your friends and earn 10% of the points they earn.', '11. The INIT points will be converted to INIT tokens after the token goes live.', '12. For more information regarding the airdrop, see this Medium article.']",n/a,Airdrop Confirmed,Mantle,n/a,0,https://init.capital/,INIT,n/a,https://airdrops.io/visit/v4m2/,https://airdrops.io/wp-content/uploads/2024/01/INIT-Capital-logo.jpg,n/a,n/a,n/a,https://airdrops.io/visit/w4m2/,https://twitter.com/InitCapital_,n/a,n/a,n/a,n/a,n/a,n/a,n/a
Renzo,Renzo is a Liquid Restaking Token (LRT) and Strategy Manager for EigenLayer. It is the interface to the EigenLayer ecosystem securing Actively Validated Services (AVSs) and offering a higher yield than ETH staking. The protocol abstracts all complexity from the end-user and enables easy collaboration between them and EigenLayer node operators.,"['1. Visit the Renzo website.', '2. Connect your MetaMask, Trust Wallet, or any of the wallets mentioned.', '3. Select the token and chain that you wish to stake.', '4. Renzo currently supports tokens from Ethereum, Arbitrum, Binance, Base, and a few other chains.', '5. You will need some ETH, wBETH, stETH or wETH. You can get them on Binance.', '6. Now, stake your tokens.', '7. You will get the ezETH (LRT) in return.', '8. Now, you will start earning yield.', '9. Because it’s built on EigenLayer, you will also start earning EigenLayer points as well as Renzo ezPoints.', '10. Also, get 10% of Renzo points from each referral.', '11. Users who had staked and earned at least 360 points were eligible for the Season 1 airdrop, which has now ended.', '12. Season 2 of the airdrop has begun and 5% of the REZ supply is allocated for the airdrop.', '13. Additionally, season 1 participants will receive a 10% boost.', '14. For more details about the updated airdrop conditions, visit the official announcement.']",n/a,Airdrop Confirmed,eth,n/a,0,https://www.renzoprotocol.com/,N/A,n/a,https://airdrops.io/visit/04m2/,https://airdrops.io/wp-content/uploads/2024/01/Renzo-logo.jpg,n/a,https://t.me/RenzoProtocolChat,n/a,https://discord.gg/FMwGPDXXtf,https://twitter.com/RenzoProtocol,n/a,n/a,https://github.com/Renzo-Protocol,n/a,n/a,n/a,n/a
B² Network,"B² Network is a Layer-2 solution that bolsters transaction speed and broadens application diversity without sacrificing security. B² Network is the first zero-knowledge proof verification commitment rollup on Bitcoin. Leveraging rollup technology, B² Network provides a platform capable of running Turing-complete smart contracts for off-chain transactions, which enhances transaction efficiency and minimizes costs.","['1. Visit the B² Network Buzz airdrop page.', '2. Enter the invite code “IrsRO“.', '3. Follow them on Twitter, connect your wallet and sign up.', '4. Now, deposit tokens.', '5. You could deposit BTC on the Bitcoin network, wBTC, USDT, USDC and ETH on Ethereum, BTCB on BNB Chain, ORDI, SATS, and MATIC.', '6. Bridged assets can be withdrawn back to the Layer 1 networks in April 2024.', '7. You will start earning yield and points in the form of parts based on the value of assets bridged and the length of time staked.', '8. Also, earn more parts for each referral.', '9. Parts can be collected to assemble mining rigs.', '10. In phase 3 of the Buzz campaign, users will have the opportunity to mine B² tokens (a mimic event of the Mining of Bitcoins). The more rigs you own, the more tokens you can mine.', '11. They’ve confirmed to airdrop 5% of the total supply of B² native token to Buzz airdrop participants.', '12. Also join their Odyssey campaign to likely earn even more tokens.', '13. For more information regarding the Buzz airdrop, see this Medium article.']",5% of the total supply,Expired,ownchain,n/a,0,https://www.bsquared.network/,N/A,n/a,https://airdrops.io/visit/l6m2/,https://airdrops.io/wp-content/uploads/2024/02/B%C2%B2-Network-logo.jpg,n/a,https://t.me/bsquared_chat,n/a,https://www.discord.gg/bsquarednetwork,https://twitter.com/BSquaredNetwork,n/a,n/a,https://github.com/b2network,n/a,n/a,n/a,n/a
Aether,"Aether is the first EVM consumer chain with full vertical integration & core DeFi primitives. Aether is the first community owned project built on cosmos replicated security distributed only via airdrop and lockdrop, no private token sales or external funding. Aether's goal is to create life long financial symbiosis with the Cosmos Hub.","['1. Download and install the Keplr wallet.', '2. You will need ATOM. You can get it on Binance.', '3. Now, deposit your ATOM into your wallet.', '4. Go to the Keplr dashboard and stake your ATOM.', '5. Stride’s stATOM holders, Quicksilver Protocol’s qATOM holders, and pSTAKE’s stkATOM holders are also eligible.', '6. They’ve confirmed to airdrop 40% of the total supply to ATOM, stATOM and stkATOM stakers.', '7. ATOM holders are also eligible, but stakers will receive more allocation.', '8. The snapshot has not been taken yet as per the latest tweet.', '9. Check the airdrop announcement from here.']",40% of the total supply,Airdrop Confirmed,ownchain,n/a,0,https://twitter.com/AetherEVM_,AETHER,"122,222,222 AETHER",n/a,https://airdrops.io/wp-content/uploads/2024/01/Aether-logo.png,n/a,https://t.me/AetherEVM,n/a,n/a,https://twitter.com/AetherEVM_,n/a,n/a,n/a,n/a,n/a,n/a,n/a
Nostra,"Nostra is a one-stop DeFi solution built on Starknet where users can lend, borrow, and trade crypto. Their mission is to build the most scalable and accessible DeFi products with advanced features using the fastest and cheapest layer-2 solution without compromising Ethereum’s security.","['1. Visit the Nostra website.', '2. Connect or set up Braavos Wallet or any Starknet wallets.', '3. You will need some ETH and/or other tokens on StarkNet. You can get these tokens on Binance.', '4. You can then use Rhino.fi to bridge assets from other networks to StarkNet.', '5. Now go to “Lend” and deposit some tokens.', '6. Also, try to borrow some tokens.', '7. You will earn Nostra points for lending and borrowing on the platform.', '8. Also, earn more points for each referral.', '9. You will receive an extra 5% lifetime bonus if you sign up using the above link.', '10. For more information regarding the Nostra points program, see this page.', '11. They’ve confirmed to launch their token “NOS” in the future.', '12. Users who collect points may get an airdrop when their token goes live.', '13. Nostra is also giving free STRK tokens to users who provide liquidity to the STRK/USDC, STRK/ETH, ETH/USDC and USDC/USDT pools based on users’ activity. After the initial two-week lookback period, LPs can claim their STRK incentives based on their activity during the previous weeks. For more info, read this article.', '14. Please note that there is no guarantee that they will do an airdrop to early users. It’s only speculation.']",n/a,Expired,StarkNet,n/a,0,https://nostra.finance/,NOS,n/a,https://airdrops.io/visit/wxl2/,https://airdrops.io/wp-content/uploads/2024/01/Nostra-logo.jpg,n/a,n/a,n/a,https://discord.gg/nostrafinance,https://twitter.com/nostrafinance,n/a,n/a,https://github.com/tempus-finance/nostra-app,n/a,n/a,n/a,n/a
Rabby Wallet,"Rabby Wallet is an open source browser plugin for the DeFi ecosystem, providing users with a better-to-use and more secure multi-chain experience. It offers a smooth multi-chain experience by automatically switching to the corresponding chain based on your visited Web3 dApp. Their security rule engine lets you check errors and risks before signing transactions.","['1. Download the Rabby Wallet for Chrome.', '2. Install the wallet and import your existing wallet or create a new one.', '3. Now click on “Rabby Points” from the wallet.', '4. Make sure to enter “GETAIRDROPS” in the referral code field.', '5. Now engage in on-chain activities, make swaps, etc, to start earning points.', '6. Also, get 50 points for each referral who gets 100 points.', '7. You need to claim your earned points manually from the wallet for them to be counted.', '8. For more information regarding the points program, see this tweet.', '9. They don’t have their own token yet but have hinted at rewarding the users.', '10. The first round of the points program ended on May 31st.', '11. Season 2 has now begun, and users can earn initial bonus points for importing their active wallet balance≥ $1. You will also get points if you’re new to Rabby.', '12. Season 2 ends on June 30th at 23:59 (UTC+0).', '13. Users who accumulate points in their wallet may receive an airdrop if they launch their own token.', '14. Since the wallet is by DeBank, using it may make you eligible for the DeBank speculative airdrop as well.', '15. Please note that there is no guarantee that they will do an airdrop and that they will launch their own token. It’s only speculation.']",n/a,Expired,eth,n/a,0,https://rabby.io/,N/A,n/a,n/a,https://airdrops.io/wp-content/uploads/2024/01/Rabby-Wallet-logo.jpg,n/a,n/a,n/a,https://discord.gg/seFBCWmUre,https://twitter.com/Rabby_io,n/a,n/a,https://github.com/RabbyHub/Rabby,n/a,n/a,n/a,n/a
Bitcoin Virtual Machine,Bitcoin Virtual Machine has built a B2B modular blockchain metaprotocol that lets developers customize and launch their own full-featured Bitcoin L2 blockchains in a few clicks (aka. similar to spinning up a decentralized AWS instance).,"['1. Visit the Bitcoin Virtual Machine website.', '2. Hold and drag the key.', '3. Now click on “Get on the allowlist”.', '4. Complete the first “Tweet about BVM” task.', '5. You will get 1,000 points.', '6. Complete additional tasks to earn more points.', '7. Also, get 1,000 points for each referral.', '8. They’ve confirmed to launch a token called BVM in the future.', '9. Users who collect points on allowlist may get an airdrop when their token goes live.', '10. Please note that there is no guarantee that they will do an airdrop to early users. It’s only speculation.']",n/a,Expired,BRC-20,n/a,0,https://bvm.network/,BVM,"100,000,000 BVM",https://airdrops.io/visit/6xl2/,https://airdrops.io/wp-content/uploads/2024/01/Bitcoin-Virtual-Machine-logo.jpg,n/a,n/a,n/a,n/a,https://twitter.com/BVMnetwork,n/a,n/a,n/a,n/a,n/a,n/a,n/a
StackingDAO,"StackingDAO is a liquid stacking protocol that gives users an auto compounding tokenised representation of stacked STX (stSTX). stSTX has the potential to become a key primitive for the nascent Bitcoin DeFi ecosystem, especially as collateral. Borrowing against stSTX will be the most tax efficient way to get liquidity against STX for STX holders.","['1. Visit the StackingDAO website.', '2. Connect your Stacks wallet.', '3. You will need some STX. You can get it on Binance.', '4. Now stake some STX.', '5. You will receive stSTX, which is the liquid token of StackingDAO.', '6. Now, you will start earning yield on your staked STX.', '7. You will also earn points for staking STX.', '8. Refer your friends and earn 10% of the points from each referral.', '9. They don’t have their own token yet, but users who collect points may get an airdrop if they launch their token.', '10. Please note that there is no guarantee that they launch their token or will do an airdrop to early users. It’s only speculation.']",n/a,Airdrop Unconfirmed,Stacks,n/a,0,http://stackingdao.com/,N/A,n/a,https://airdrops.io/visit/wwl2/,https://airdrops.io/wp-content/uploads/2024/01/StackingDAO-logo.jpg,n/a,https://t.me/+0jPjegAOoMwyNTU0,n/a,n/a,https://twitter.com/StackingDao,n/a,n/a,https://github.com/StackingDAO/contracts,n/a,n/a,n/a,n/a
NAVI Protocol,"NAVI Protocol is the first Native One-Stop Liquidity Protocol on Sui. It enables users to participate as liquidity providers or borrowers within the Sui Ecosystem. Liquidity providers supply assets to the market, earning passive income through yields, while borrowers have the flexibility to obtain loans for different assets. With its focus on providing essential DeFi infrastructure, Navi aims to be a key player in the rapidly evolving world of DeFi in the Sui Ecosystem.","['1. Visit the NAVI Protocol website.', '2. Connect your Sui wallet.', '3. You will need some SUI and/or other tokens. You can get it on Binance.', '4. You can use the Portal bridge powered by Wormhole to transfer assets to and from Sui. By doing so, you could also potentially qualify for the Wormhole speculative airdrop.', '5. Now supply the tokens.', '6. Also, try to borrow some tokens.', '7. They don’t have their own token yet but have confirmed to launch “NAVI” in the future.', '8. Users who do lending and borrowing on the platform may become eligible for the airdrop when the token goes live.', '9. Please note that there is no guarantee that they will do an airdrop to early users. It’s only speculation.']",n/a,Airdrop Unconfirmed,Sui,n/a,0,https://www.naviprotocol.io/,NAVI,n/a,https://airdrops.io/visit/7ul2/,https://airdrops.io/wp-content/uploads/2024/01/Navi-Protocol-logo1.png,n/a,https://t.me/navi_protocol,n/a,https://discord.gg/R6Xkbee8Xq,https://twitter.com/navi_protocol,n/a,n/a,n/a,n/a,n/a,n/a,n/a
Mind Network,"Mind Network is one of the first tokenized startups to apply the long-awaited 'Holy Grail of Encryption' to Web3. Mind Network is a Zero Trust Layer that offers a security and data privacy solution that achieves true CrossFi scale, complying with regulatory requirements while staying true to Web3 principles of asset tokenization and individual data ownership.","['1. Visit the Mind Network testnet page.', '2. Click on “Connect wallet”.', '3. Change the network to Polygon Mumbai testnet. You can add it from Chainlist.', '4. You will need some testnet MATIC. You can get it from here.', '5. Now click on “Register” and sign the message.', '6. Also, repeat the above steps using a different wallet.', '7. Now go to “Transfer” and send some MATIC from your wallet to the second wallet you’ve registered.', '8. Try to do transfers on multiple wallets.', '9. Now complete the Galxe tasks.', '10. They don’t have their own token yet but could launch it in the future.', '11. Early users who do the testnet actions may get an airdrop if their token goes live.', '12. Please note that there is no guarantee that they will launch their own token or do an airdrop to early users. It’s only speculation.']",n/a,Airdrop Unconfirmed,Polygon,n/a,0,https://mindnetwork.xyz/,N/A,n/a,https://airdrops.io/visit/tsl2/,https://airdrops.io/wp-content/uploads/2024/01/Mind-Network-logo.jpg,n/a,https://t.me/MindNetwork_xyz,https://t.me/mindnetwork_announcements,https://discord.gg/UYj94MJdGJ,https://twitter.com/mindnetwork_xyz,n/a,n/a,https://github.com/mind-network,n/a,n/a,n/a,https://www.youtube.com/embed/vCzm1Xky_V0?feature=oembed
XION,"XION is the first crypto-abstracted layer 1 blockchain specifically built for consumer adoption designed to reach billions of non-technical users. XION allows the development of next-generation mass-market projects with full native account abstraction including MPC security and seamless email login, mobile support, lightning-fast gasless transactions, native on & off ramps, global direct credit/debit card purchasing, fiat denomination, includes native interoperability with 50+ other networks, and more.","['1. Visit the XION testnet page.', '2. Click on “Connect”.', '3. Submit your email and sign up.', '4. Now, connect your Twitter and Discord accounts to the dashboard.', '5. You will now be able to mint the “Welcome” NFT.', '6. You will get 150 XP.', '7. Also, refer your friends to earn more XPs.', '8. You could also mint the “Referral” NFT for referring at least two friends.', '9. Also, make sure to join their Discord channel, complete Guild tasks and claim roles.', '10. For more information regarding the testnet, see this article.', '11. They don’t have their own token yet but could launch one in the future.', '12. Early users who do testnet actions may get an airdrop if they launch their own token.', '13. Please note that there is no guarantee that they will launch their own token or do an airdrop to early users. It’s only speculation.']",n/a,Airdrop Unconfirmed,ownchain,n/a,0,https://xion.burnt.com/,N/A,n/a,https://airdrops.io/visit/esl2/,https://airdrops.io/wp-content/uploads/2024/01/XION-logo.jpg,n/a,n/a,https://t.me/xion_announcements,https://airdrops.io/visit/fsl2/,https://twitter.com/burnt_xion,n/a,n/a,n/a,n/a,n/a,n/a,n/a
Web3Go,"Web3Go is a data intelligence network that connecting humans, data, and AI. Their goal is to make data open and accessible to everyone. By leveraging the synergy of streaming data and AI, they empower users to mine and unlock the true value of data.","['1. Visit the Web3Go Reiki website.', '2. Click on “Log in” and connect your wallet.', '3. Now go to your profile and mint the passport. You will need some BNB to pay for gas. You can get BNB from Binance.', '4. You will get gold leaves points.', '5. Go to the taskboard and complete simple tasks to earn more gold leaves points.', '6. You will also get points for daily check-in.', '7. Refer your friends and get 10% gold leaves from tier 1 referral and 2% from tier 2 referral up to a maximum of 10 referrals.', '8. They don’t have their own token yet, but they’ve confirmed to do an airdrop to early users who sign up on their platform, mint the passport and collect Gold leaves.']",n/a,Airdrop Confirmed,Binance Smart Chain,n/a,0,https://web3go.xyz/,N/A,n/a,https://airdrops.io/visit/frl2/,https://airdrops.io/wp-content/uploads/2024/01/Web3Go-logo.jpg,n/a,https://t.me/Web3GoCommunity,n/a,https://airdrops.io/visit/grl2/,https://twitter.com/Web3Go,n/a,n/a,https://github.com/web3go-xyz,n/a,n/a,n/a,n/a
Pike,"Pike is a Universal Liquidity Protocol, it is designed to unleash utility for native assets by aggregating liquidity across blockchain networks. Pike’s vision is to become a universal liquidity layer that enables frictionless movement and accessibility of native assets across ecosystems. Pike is built on top of Wormhole’s Cross-Chain Data Messaging and Circle’s Cross-Chain Transfer Protocol (CCTP).","['1. Visit the Pike website.', '2. Connect your wallet.', '3. Now change the network to Ethereum, Optimism, Arbitrum or Base.', '4. You will need some ETH or other tokens. You can get it on Binance.', '5. You could also use Rhino.fi to bridge assets from an unsupported network to one of the supported networks mentioned above.', '6. Now supply some assets.', '7. Then, also try to borrow some tokens.', '8. Also, join their Discord channel and complete Guild tasks .', '9. They don’t have their own token yet but have hinted at launching one.', '10. The early users who lend and borrow on the platform may get an airdrop if they launch their own token.', '11. Pike is powered by Wormhole’s cross-chain technology, so you could also thereby become eligible for the Wormhole speculative airdrop.', '12. Please note that there is no guarantee that they will launch their own token or do an airdrop to early users. It’s only speculation.']",n/a,Airdrop Unconfirmed,eth,n/a,0,https://www.pike.finance/,N/A,n/a,https://airdrops.io/visit/nql2/,https://airdrops.io/wp-content/uploads/2024/01/logo.jpg,n/a,https://t.me/pike_finance,n/a,https://airdrops.io/visit/jql2/,https://twitter.com/PikeFinance,n/a,n/a,n/a,n/a,n/a,n/a,n/a
