Title,Features,Guide,Total_Value,Status,Platform,Requirements,Num_Of_Prev_Drops,Website,Ticker,Total_Supply,Whitepaper,Thumbnail,Facebook,Telegram Group,Telegram Channel,Discord,Twitter,Medium,CoinGecko,GitHub,Coinmarketcap,Reddit,Exchanges,Youtube
Initia,"Initia stands as a beacon of innovation and simplicity. They're on a mission to redefine the multi-chain network experience from the ground up. By seamlessly integrating architecture, product, and economic systems, Initia offers a holistic solution that transforms how networks operate, feel, and interact.","['1. Visit the Initia XP testnet page.', '2. Connect the Initia wallet or an external wallet like Metamask.', '3. Now, you must complete all the six tasks mentioned on the XP page.', '4. Click on “Task 1” and get testnet tokens. You will receive two tokens from the faucet.', '5. GAS will be used to pay for gas on the Initia L1 during Public Testnet. INIT, the native token of Initia, is used across the L1 network and L2 Minitias.', '6. Now go to “Task 2” and register an Initia username.', '7. Then go to “Task 3” and swap 1 INIT for tokens.', '8. Go to “Task 4” and stake INIT with a validator.', '9. Then go to “Task 5” and stake the LP with a validator.', '10. Now complete the final “Task 6” by claiming the staking rewards.', '11. You will get XP for completing tasks. Interact more to earn more XPs.', '12. After completing all the above tasks, you will be able to mint NFT cards.', '13. It may take some time for the completed tasks to be verified and for you to be able to collect cards.', '14. Collect all six NFT cards to create a Level 1 Baby Jennie.', '15. Feed your Jennie once every week with your earned XP to level up your Jennie.', '16. You will then be able to enter our referral code “R73SMXWR” to receive a bonus of 50 XP.', '17. Also, refer your friends to get 5% of the referee’s XP.', '18. The testnet XP campaign will run for eight weeks, so try to collect as much XP as possible.', '19. They’ve confirmed that they’ll launch their own token, “INIT”. So it’s very likely that the users who collect XPs and level up Jennie will get an airdrop when their token goes live.', '20. For more information regarding the testnet campaign, see this Medium article.']",n/a,Airdrop Unconfirmed,ownchain,n/a,0,https://initia.xyz/,INIT,n/a,https://airdrops.io/visit/c3p2/,https://airdrops.io/wp-content/uploads/2024/05/Initia-logo.jpg,n/a,n/a,n/a,https://airdrops.io/visit/e3p2/,https://airdrops.io/visit/d3p2/,n/a,n/a,https://github.com/initia-labs,n/a,n/a,n/a,n/a
Liquidium,"Liquidium is the leading platform enabling peer-to-peer Bitcoin lending. Users can borrow or lend Bitcoin, using unique Bitcoin-based assets called Ordinal Inscriptions (Ordinals) as collateral. This is facilitated securely through Partially Signed Bitcoin Transactions (PSBTs) and Discreet Log Contracts (DLCs) all on Layer-1 Bitcoin.","['1. Visit the Liquidium website.', '2. Click on “Connect” and connect your Xverse or Magic Eden Bitcoin wallet.', '3. You will get 1.5x points for interacting with the Xverse wallet.', '4. You will need some BTC first. You can get it on Binance.', '5. Now go to “Lend”, select an Ordinal collection and lend BTC.', '6. Go to “Borrow” and select an Ordinal collection that you own to use as collateral to borrow BTC.', '7. You will start earning points for lending and borrowing on the platform.', '8. Also, earn 10% of the points from each referral.', '9. You can track your points from the leaderboard page.', '10. They don’t have their token yet but have hinted at launching one in the future and converting points for tokens.', '11. For more information regarding the points campaign, see this page.']",n/a,Airdrop Unconfirmed,Bitcoin,n/a,0,https://www.liquidium.fi/,N/A,n/a,https://airdrops.io/visit/p8p2/,https://airdrops.io/wp-content/uploads/2024/05/Liquidium-logo.jpg,n/a,n/a,n/a,https://airdrops.io/visit/r8p2/,https://airdrops.io/visit/q8p2/,n/a,n/a,n/a,n/a,n/a,n/a,n/a
Infinex,"Infinex is a cross-chain wallet that currently supports the major EVM chains plus Solana, replacing the need for managing multiple wallets, gas, and bridging. It’s secured with a passkey and is recoverable, removing the need to manage passwords and seed phrases. It’s also self-custodial, meaning your assets are always yours.","['1. Visit the Infinex website.', '2. Submit a username and create a passkey to create your account.', '3. Go to “Settings”, enable “Funds Recovery” and submit a recovery address to withdraw funds in the future.', '4. Now, deposit supported assets into your Infinex Account. You can get most of the assets from Binance.', '5. Go to “Deposit”, select a network and deposit tokens to the generated deposit address.', '6. Then, stake the tokens.', '7. You will start earning crates for staking.', '8. Crates contain Patron NFTs, passes, boosts and ecosystem prizes.', '9. Prizes will be distributed after the end of the Craterun campaign.', '10. The campaign will end on July 30th at 00:00 UTC.', '11. They also don’t have their token yet, so if they launch it, the users who collect crates will likely also get a token airdrop.', '12. For more information regarding the campaign, see this article.']",n/a,Airdrop Unconfirmed,eth,n/a,0,https://infinex.xyz/,N/A,n/a,n/a,https://airdrops.io/wp-content/uploads/2024/05/Zkzg4kfY_400x400.jpg,n/a,n/a,n/a,https://discord.gg/infinex,https://airdrops.io/visit/39p2/,n/a,n/a,n/a,n/a,n/a,n/a,n/a
Vooi,"Vooi is an intent-based, cross-chain perpetual DEX aggregator that supports multiple EVM and non-EVM networks. It offers the flexibility to integrate additional networks as needed. Vooi facilitates leveraged trades on perpetual DEXs across supported networks, prioritizing trading efficiency and simplifying the management of gas expenses. Additionally, Vooi provides a unified interface for perpetual DEXs across supported chains.","['1. Visit the Vooi DEX page.', '2. Connect your wallet.', '3. Change the network to Arbitrum, Optimism or Base.', '4. Click on “Enable Trading”.', '5. You will need some ETH to cover gas fees and USDC to make trades. You can get them on Binance.', '6. Go back to Vooi and deposit USDC.', '7. Now select a market and open a trading position.', '8. Click on “Earn Rebates” and refer your friends to get a 20% trading fee rebate from each referral.', '9. You will also earn Orderly Network Merits for trading on Vooi.', '10. They do not have their own token yet but are likely to launch one in the future.', '11. Users who make trades would likely become eligible for an airdrop if they launch their token.', '12. For more information regarding the Vooi DEX, see this Medium article.']",n/a,Airdrop Unconfirmed,Arbitrum,n/a,0,https://vooi.io/,N/A,n/a,https://airdrops.io/visit/u2p2/,https://airdrops.io/wp-content/uploads/2024/05/vooi-logo.jpg,n/a,n/a,n/a,https://discord.gg/vooi,https://airdrops.io/visit/v2p2/,n/a,n/a,https://github.com/vooi-app,n/a,n/a,n/a,n/a
Delabs Games,"Delabs Games is a “Playable Layer” that organically intertwines the gamers, the games, and the platform. It is a unique platform model conceptualized to address the challenges of existing gaming platform structures.","['1. Visit the Delabs Games website.', '2. Connect your MetaMask, Coinbase, or OKX wallet.', '3. Enter the referral code “G0YYU2PT” and confirm it.', '4. You will get 100 points.', '5. Connect your X account and complete easy social tasks.', '6. You will earn free points for completing the tasks.', '7. You can also earn free points by completing daily check-in and daily draw tasks.', '8. Delabs Games is also airdropping free points for holding their NFTs.', '9. Additionally, you can earn free points for inviting your friends.', '10. Users who collect the points will likely earn a share of the GAME airdrop allocation.']",n/a,Airdrop Confirmed,eth,"Twitter: Follow, Multiple Retweets",0,https://app.delabs.gg/,GAME,"3,000,000,000 GAME",https://airdrops.io/visit/x3p2/,https://airdrops.io/wp-content/uploads/2024/05/U9OBjHpW_400x400.png,n/a,n/a,n/a,https://airdrops.io/visit/04p2/,https://twitter.com/delabsOfficial,n/a,n/a,n/a,n/a,n/a,n/a,https://www.youtube.com/embed/kMXLBCdmHdc?feature=oembed
World PvP,World PvP is an immersive gaming platform that offers an expansive player-vs-player (PvP) experience built on the Base network.,"['1. Visit the World PvP website.', '2. Choose a country from the 211 available, each with its own unique coin.', '3. Aim to increase your country’s market cap.', '4. Accumulate the highest amount of your country’s token to become president.', '5. As president you can decide strategic actions, including the decision to nuke a rival country if you win.', '6. The country with the highest market cap at the end of each round wins.', '7. As president of the winning country, unlock a nuclear missile to use against any country of your choosing.', '8. The nuke will target and drain the liquidity of the chosen country.', '9. The liquidity rug will convert the drained assets into ETH.', '10. 50% of the ETH gained will be allocated to the country that launched the nuke.', '11. The remaining 50% will be randomly distributed to another country on the map.', '12. Even if you don’t play, your address will be saved in a special list if you interact with them by chatting in their global chat.', '13. The team has recently confirmed that 1% of the supply from every country will be reserved for giveaways and airdrops.', '14. The team has also confirmed a points campaign. Points can be earned in 4 ways: 1) for country decorations (pay ~$5 in ETH to decorate any country with your own image), 2) nuke victims (points given to country token holders that get nuked out of the game), 3) trading (buying/selling country tokens) and 4) referrals.']",n/a,Airdrop Confirmed,BASE,n/a,0,https://worldpvp.co,N/A,n/a,n/a,https://airdrops.io/wp-content/uploads/2024/05/XI-SRdmp_400x400-1.png,n/a,n/a,n/a,n/a,https://twitter.com/worldpvpco,n/a,n/a,n/a,n/a,n/a,n/a,n/a
Thruster,"Thruster is building a yield-first DEX on Blast for the best Blast-native teams and tokens to build on. Thruster is deeply integrated across the Blast ecosystem, with integrations with most of the top protocols, tokens, and liquidity providers in the ecosystem. Liquidity provider tools are also essential for Thruster, and allow for better yield capture for LPs.","['1. Visit the Thruster website.', '2. Connect your wallet and change the network to Blast.', '3. You will need some ETH and/or tokens on Blast. You can get ETH from Binance.', '4. You can use Rhino.fi to bridge ETH or tokens from other networks to Blast.', '5. Now go to “Swap” and make swaps.', '6. Go to “Analytics” and provide liquidity to any pools.', '7. You will start earning points in the form of “Credits” for making swaps and providing liquidity.', '8. You can also earn credits for providing liquidity to partner protocols such as Juice.', '9. Also, earn a share of the credits from your referrals.', '10. They’ve confirmed that they’ll launch their token, “THRUST” and they’ve also hinted at rewarding early users who earn credits.', '11. Users who collect credits will likely get an airdrop when their token goes live.', '12. For more information regarding the credits campaign, see this page.']",n/a,Airdrop Unconfirmed,Blast,n/a,0,https://www.thruster.finance/,THRUST,n/a,https://airdrops.io/visit/a0p2/,https://airdrops.io/wp-content/uploads/2024/05/Thruster-logo.jpg,n/a,n/a,n/a,https://discord.gg/thrusterfi,https://twitter.com/ThrusterFi,n/a,n/a,n/a,n/a,n/a,n/a,n/a
Token Metrics,"Token Metrics is a cryptocurrency investment research firm that uses AI and machine learning, along with our set of data scientists, quant traders, and crypto native research analysts, to provide timely insights on more than 6,000 crypto and NFT projects. Token Metrics is one of the leading blockchain tools, running since 2019 and boasting over 50k active users.","['1. Visit the Token Metrics Galxe Quest page.', '2. Log in with your X, Discord account, or email address.', '3. Complete easy social tasks to earn free points.', '4. The more activities you complete, the more points you will earn, which will help you earn a bigger share of TMAI token rewards.']",n/a,Airdrop Confirmed,eth,E-Mail,0,https://www.tokenmetrics.com/,TMAI,n/a,n/a,https://airdrops.io/wp-content/uploads/2024/05/X7NIVGgd_400x400.jpg,https://www.facebook.com/tokenmetrics/,https://t.me/TokenMetricsDiscussion,https://t.me/tokenmetrics,https://airdrops.io/visit/cwo2/,https://twitter.com/tokenmetricsinc,n/a,n/a,n/a,n/a,n/a,n/a,n/a
Tari,Tari is the end-state blockchain protocol,"['1. Visit the Tari airdrop page.', '2. Click on “Log in with X” and connect your Twitter account.', '3. Now complete the quests to earn points in the form of “Gems”.', '4. You must complete the first two quests to be eligible for the airdrop.', '5. Also, get 1,000 gems from each referral that signs up and completes the “Follow on X” quest.', '6. You will also be able to earn “Turtle Shells” and “Sky Hammers” by owning rare Gen 0 or Gen 1 Yats. Owning these would also increase your gems and airdrop.', '7. They’ve confirmed that they will airdrop XTM tokens to users who participate in the airdrop campaign and collect gems.', '8. For more information regarding the airdrop, see this article.']",n/a,Airdrop Confirmed,ownchain,n/a,0,https://www.tari.com/,XTM,n/a,https://airdrops.io/visit/0xo2/,https://airdrops.io/wp-content/uploads/2024/05/Tari-logo.jpg,n/a,https://t.me/tariproject,n/a,https://discord.gg/tari,https://twitter.com/tari,n/a,n/a,https://github.com/tari-project,n/a,https://airdrops.io/visit/1xo2/,n/a,https://www.youtube.com/embed/9nrZE76O18U?feature=oembed
Zyfi,"Zyfi is a set of tools that leverages zkSync's native account abstraction (AA) to provide a seamless on-chain experience to users. They offer a full-stack solution ranging from a front-end to an API that lets any dApp propose gasless transactions, enabling users to pay with any ERC-20 tokens.","['1. Visit the Zyfi quests airdrop page.', '2. Connect your wallet.', '3. Now, complete the social tasks by connecting your Twitter and Discord accounts.', '4. You will get 70 points.', '5. You will also get a 5% boost if you’ve signed up using the above link.', '6. Now, make swaps on Zyfi Swap to earn more points.', '7. You will need some ETH and /or other tokens on zkSync. You can get ETH from Binance.', '8. You can then use Rhino.fi to bridge ETH or other tokens from other networks to zkSync.', '9. Also, interact with the other protocols mentioned on the quest page to earn more points.', '10. The more gas you spend, the more points you’re going to earn.', '11. Also, get 10% of the points from each referral.', '12. They’ve allocated 10% of the total supply to the community, including the quest participants, so the users who interact with the above quest will get an airdrop when their token goes live.', '13. For more information regarding the airdrop, see this article.']",n/a,Airdrop Confirmed,eth,n/a,0,https://www.zyfi.org/,N/A,n/a,https://airdrops.io/visit/3wo2/,https://airdrops.io/wp-content/uploads/2024/05/Zyfi-logo.jpg,n/a,https://t.me/joinchat/3-fAd9pmy9gwODlk,n/a,https://airdrops.io/visit/4wo2/,https://twitter.com/Zyfi_org,n/a,n/a,n/a,n/a,n/a,n/a,n/a
Elfin,"Elfin is a GameFi project merging decentralized finance yield farming and non-fungible tokens with gamified elements in a play-to-earn platform that lets users collect, battle, and farm to earn more with their crypto. Through a virtual business operation in a set of small towns that consist of farming, harvesting, banking, and factory processing functionalities, Elfin seamlessly fuses the best applications of Decentralized Finance and GameFi into one gaming metaverse.","['1. Visit the Elfin website.', '2. Click on “Sign in” and connect your wallet to the Binance Smart Chain testnet.', '3. You will need some testnet BNB. You can get it from here.', '4. Now click on “Airdrop” from the top.', '5. Now, complete the simple tasks to earn points.', '6. You can get points by checking in daily, depositing testnet BNB and playing games.', '7. Also, get more points from each referral.', '8. They’ve confirmed that they will airdrop ELFIN tokens to users who collect points.', '9. The points will be converted to ELFIN tokens after the TGE.', '10. For more information regarding the airdrop, see this tweet.']",n/a,Expired,Binance Smart Chain,n/a,0,https://elfin.games/,ELFIN,n/a,https://airdrops.io/visit/0mo2/,https://airdrops.io/wp-content/uploads/2024/05/Elfin-logo.jpg,n/a,https://t.me/ElfinKDM,n/a,https://airdrops.io/visit/1mo2/,https://twitter.com/ElfinGames,n/a,n/a,n/a,n/a,https://airdrops.io/visit/2mo2/,n/a,https://www.youtube.com/embed/oMPvPn_APoU?feature=oembed
Xtremeverse,"Xtremeverse is a web3 anime gaming universe built by Glip, a collective of 25 artists and engineers from Tencent, Epic Games, Hoyoverse, Netease, Crytek, 2K, Ubisoft. Their first title is an anime mobile shooter, BTX Battle Xtreme. BTX is a unique blend of mobile shooter, extraction gameplay, anime art and web3 economy, making it appealing to web2 and web3 gamers. Through unique art, compelling gameplay and sustainable economy, BTX will onboard hundreds of millions of gamers to web3.","['1. Visit the Xtremeverse airdrop page.', '2. Connect your wallet.', '3. Now, connect your Twitter account.', '4. You will get 25 points.', '5. Complete additional social tasks to earn more points.', '6. Complete all the tasks to unlock daily loot boxes, which can give you additional points of up to 500 points.', '7. Hold their NFT token “XTREME” to earn additional points.', '8. Also, get 100 points from each referral who signs up and completes at least 1 task.', '9. They’ve confirmed to launch the “XVERSE” token in the future and do an airdrop for users who collect points.']",n/a,Airdrop Confirmed,eth,n/a,0,https://xtremeverse.xyz/,XVERSE,n/a,https://airdrops.io/visit/ggo2/,https://airdrops.io/wp-content/uploads/2024/04/Xtremeverse-logo.png,n/a,n/a,n/a,https://discord.gg/invite/xtremeverse,https://twitter.com/0xtremeverse,n/a,n/a,n/a,n/a,n/a,n/a,n/a
Fyde,"Fyde bridges AI x DeFi by bringing the new Liquid Vault archetype to Ethereum. Fyde helps users consistently lock in gains, earn yield, and stay liquid. Liquid Vaults accept a variety of tokens which are automatically distributed across a diverse range of tokens and rising narratives. Gains from winners are locked in, and losses from losers are reduced. Users deposit to receive TRSY, the vault wrapper token, which is pegged 1:1 with the vault. Through its AI models, Fyde helps protect against rugpulls and severe downside events, enabling users to grow crypto holdings faster with less volatility.","['1. Visit the Fyde Liquid Vault page.', '2. Connect your Ethereum wallet.', '3. Now click on “Deposit” and enter the referral code “1X1-LQQNRk” to get boosted points.', '4. You can deposit one of 40 different tokens, including ETH and wETH. You can get ETH from Binance.', '5. Enter the amount of the token you want to deposit and receive TRSY upon depositing.', '6. TRSY is given to depositors as their share of the vault and represents the performance of all of the vault’s assets.', '7. Now stake your TRSY. You will start earning Fyde points.', '8. Also, get more points by referring your friends.', '9. They’ve confirmed that they’ll launch their governance token, “FYDE,” and have hinted at an airdrop to users who collect Fyde points.', '10. For more information regarding Fyde points, see this page.']",n/a,Airdrop Confirmed,eth,n/a,0,https://www.fyde.fi/,FYDE,n/a,https://airdrops.io/visit/2go2/,https://airdrops.io/wp-content/uploads/2024/04/Fyde-logo.jpg,n/a,n/a,n/a,https://discord.gg/eFC9n3KXaC,https://twitter.com/FydeTreasury,n/a,n/a,https://airdrops.io/visit/3go2/,n/a,n/a,n/a,n/a
Sanctum,"Sanctum is a project focused on launching of new Liquid Staking Tokens (LSTs), which are uniquely supported by the Solana blockchain. The platform promises zero slippage in trades, offers yields and trading fees for deposited LSTs, and powers swaps on Jupiter and Solflare.","['1. Visit the Sanctum airdrop claim page.', '2. Connect your Solana wallet.', '3. If you’re eligible, then you will see the number of tokens you can claim.', '4. Users who’ve participated in the Sanctum Wonderland campaign and collected EXPs are eligible for the airdrop.', '5. A total of 50M CLOUD were allocated for the Wonderland Campaign participants.', '6. An additional 50M CLOUD were allocated for earnestness. Earnestness was determined by social contribution.', '7. Eligible users will have two options for claiming the tokens: Claim immediately to receive your normal airdrop allocation or wait 14 days from the airdrop start date to receive an extra 100% bonus.', '8. Users who are eligible for the Earnestness airdrop should wait 180 days for the 100% bonus.', '9. Eligible users have until April 14th, 2025, to claim the tokens.', '10. For more information regarding the airdrop, see this page.']",n/a,Airdrop Confirmed,SOL,n/a,0,https://www.sanctum.so/,CLOUD,"1,000,000,000 CLOUD",n/a,https://airdrops.io/wp-content/uploads/2024/05/IAcXR9Dr_400x400.jpg,n/a,https://t.me/sanctumso,n/a,https://discord.gg/sanctumso,https://twitter.com/sanctumso,n/a,https://airdrops.io/visit/8or2/,n/a,n/a,n/a,"https://airdrops.io/goto/kraken/, https://airdrops.io/goto/okex/, https://airdrops.io/visit/sx22/",n/a
zkPass,"zkPass is an advanced privacy-preserving protocol for private data verification. It allows users to securely and selectively validate their data on any HTTPS website, making it highly versatile for various applications, including banking and DeFi lending protocols.","['1. Visit the zkPass airdrop page.', '2. Sign up with your Google or Discord account.', '3. Complete various social tasks to earn free ZKP credits.', '4. Visit zkPass attestation page.', '5. Connect your wallet.', '6. Visit daily to attest and claim free ZKP credits.', '7. They currently don’t have a token, but they have confirmed they will launch the ZKP token in the future.', '8. ZKP credits will be converted to tokens at a 1:1 ratio during the time of TGE.']",n/a,Airdrop Confirmed,eth,Twitter: Follow | E-Mail,0,https://zkpass.org/,N/A,n/a,n/a,https://airdrops.io/wp-content/uploads/2024/05/JkCgx5bQ_400x400-1.jpg,n/a,n/a,n/a,https://airdrops.io/visit/1oo2/,https://twitter.com/zkPass,n/a,n/a,https://github.com/zkPassOfficial,n/a,n/a,n/a,n/a
Ekubo,"Ekubo is an advanced automated market maker (AMM) built on the Starknet blockchain, distinguished by its concentrated liquidity and extensibility features. It offers highly optimized contracts for lower fees and superior capital efficiency.","['1. Visit the Ekubo claim page.', '2. Connect your wallet to claim your EKUBO.', '3. 33.3% of the total supply of 10,000,000 EKUBO is available to claim by the users.', '4. 1/3 of the supply is for the users, 1/3 goes to the team, and 1/3 will be sold by the DAO.', '5. Users will receive EKUBO depending on the number of points earned.', '6. Accounts with less than 1,000 points are excluded from receiving any EKUBO tokens.', '7. There will be no vesting and no low-float high FDV games.']",n/a,Airdrop Unconfirmed,Starknet,n/a,0,https://ekubo.org/,EKUBO,"10,000,000 EKUBO",https://airdrops.io/visit/qoo2/,https://airdrops.io/wp-content/uploads/2024/05/NuCcNNxa_400x400.png,n/a,https://t.me/Ekubo_Protocol,n/a,https://airdrops.io/visit/roo2/,https://twitter.com/EkuboProtocol,n/a,n/a,https://github.com/EkuboProtocol,n/a,n/a,n/a,n/a
Particle Network,"Particle Network's goal is to abstract away the complexities associated with user onboarding and interactions across the multi-chain ecosystem, paving the way for mass Web3 adoption. Particle Network's modular L1 blockchain powers chain abstraction and coordinates Universal Accounts across chains, abstracting away wallets, gas, and unifying liquidity. It acts as a universal settlement layer, empowering existing L1s, L2s, and non-EVM blockchains through account coordination.","['1. Visit the Particle Network testnet campaign page.', '2. Click on “Join Now” and sign up with any social accounts or wallets.', '3. Enter the invite code “XB5FOE“.', '4. Connect your Twitter account and follow them on Twitter.', '5. Connect your Discord account and join their Discord channel.', '6. Now go to the “Points” dashboard.', '7. You will now need some testnet USDG.', '8. Firstly get some testnet tokens of supported chains like Ethereum Sepolia, Arbitrum Sepolia, Optimism Sepolia or Base Sepolia from here.', '9. Now click on “Deposit” from the “Points” dashboard and deposit testnet tokens from supported chains to Particle testnet.', '10. You will get testnet USDG.', '11. You will also get 200 $PARTI points.', '12. Do daily check in to earn more points.', '13. You can earn 50 points (a maximum of 100 times/day) for using USDG on the Particle Testnet to pay for gas fees on all connected chains. Check “Task 3” for more information.', '14. Also, get 100 points from each referral.', '15. New tasks and activities will be added in the future, so keep interacting with the testnet to earn more points.', '16. They don’t have their own token yet but have confirmed to do an airdrop to users who interact with the testnet and earn points.', '17. For more information regarding the testnet airdrop campaign, see this article.']",n/a,Airdrop Confirmed,ownchain,n/a,0,https://particle.network/,N/A,n/a,https://airdrops.io/visit/qlo2/,https://airdrops.io/wp-content/uploads/2024/05/Particle-Network-logo.png,n/a,n/a,n/a,https://airdrops.io/visit/rlo2/,https://twitter.com/ParticleNtwrk,n/a,n/a,https://github.com/Particle-Network,n/a,n/a,n/a,n/a
