Title,Features,Guide,Total_Value,Status,Platform,Requirements,Num_Of_Prev_Drops,Website,Ticker,Total_Supply,Whitepaper,Thumbnail,Facebook,Telegram Group,Telegram Channel,Discord,Twitter,Medium,CoinGecko,GitHub,Coinmarketcap,Reddit,Exchanges,Youtube
Ostium,"Ostium is a decentralized exchange (DEX) that allows users to gain on-chain exposure to various real-world assets, such as commodities, forex, and indices, through perpetual futures contracts.","['1. Visit the Ostium Deposit Derby campaign page.', '2. Connect your wallet.', '3. Ensure to have USDC in your wallet. If you don’t have any, head to Binance to add some to your wallet.', '4. Now deposit USDC and lock them for anywhere from 45 days to 365 days.', '5. You will receive boosted yields by locking your USDC for a longer duration.', '6. The boost access will end on August 1, 2024.', '7. Click on “Share” next your wallet address to find your referral link.', '8. They have announced that the top referrers become eligible for a redacted surprise.', '9. Visit this official announcement for more details.', '10. They don’t have their token yet but are very likely to launch one in the future.', '11. Users who provide liquidity will likely get an airdrop if their token goes live.']",n/a,Airdrop Unconfirmed,arbitrum,n/a,0,https://ostium.io/,OSTIUM,n/a,n/a,https://airdrops.io/wp-content/uploads/2024/07/ASTHYWBH_400x400.jpg,n/a,https://t.me/ostiumio,n/a,https://discord.gg/yec3pHXH3u,https://twitter.com/ostiumlabs,n/a,n/a,n/a,n/a,n/a,n/a,n/a
Usual,"Usual is a multi-chain infrastructure that aggregates the growing tokenized Real-World Assets (RWAs) from entities like BlackRock, Ondo, Mountain Protocol, M0 or Hashnote to transform them into a permissionless, on-chain verifiable, and composable stablecoin (USD0). Usual is built around the redistribution of power and ownership to users & third parties, akin to a scenario where Tether’s TVL providers would own the company and the associated revenues.","['1. Visit the Usual dashboard.', '2. Connect your wallet.', '3. Enter code “KWPOH” and click on “Join early access”.', '4. Follow them on Twitter and click on “Continue”.', '5. Now deposit stablecoins like USDC or USDT. You can get them from Binance.', '6. You will get USD0. USD0 is the first Liquid Deposit Token (LDT) backed 1:1 by Real-World Assets (RWA) with ultra-short maturity.', '7. Now boost your returns by depositing USD0 in liquidity pools or buying USD0++, an Enhanced T-Bill.', '8. You will start earning points in the form of pills for minting and holding USD0++.', '9. Also, provide liquidity to the USD0/USDC or USD0/USD0++ pool to earn more pills.', '10. Also, earn 10% of the pills from each referral.', '11. You will also start earning multipliers from the moment you mint your first USD0++ or provide liquidity. The earlier you mint, the more multipliers you can earn, up to a maximum of 10.5X.', '12. Users who collect pills will get an airdrop of the USUAL token after the TGE.', '13. A total of 7.5% of the USUAL supply minted at the TGE has been allocated for the airdrop.', '14. For more information regarding the airdrop, see this article.']",7.5% of the USUAL supply,Airdrop Confirmed,eth,n/a,0,https://usual.money/,USUAL,n/a,n/a,https://airdrops.io/wp-content/uploads/2024/07/Usual-logo.jpg,n/a,https://t.me/UsualCommunity,n/a,https://airdrops.io/visit/4gr2/,https://airdrops.io/visit/3gr2/,n/a,n/a,n/a,n/a,n/a,n/a,n/a
Reactor Fusion,ReactorFusion is a DeFi lending platform on zkSync that received just over 2.4 million ZK tokens from airdrop #1.,"['1. Head to the Reactor Fusion dApp, connect your wallet and select zkSync Era as the network.', '2. Supply some assets and/or borrow to earn ZK tokens.', '3. If you used Reactor Fusion in the past, check the RLP dashboard to see if you’re eligible for ZK as a RLP Season 0 participant.', '4. For more information about their ZK airdrop, check out this official announcement.']",n/a,Airdrop Confirmed,zksync,n/a,0,https://reactorfusion.xyz/,ZK,n/a,n/a,https://airdrops.io/wp-content/uploads/2024/07/RF.jpg,n/a,n/a,n/a,https://airdrops.io/visit/xdr2/,https://airdrops.io/visit/wdr2/,n/a,n/a,n/a,n/a,n/a,n/a,n/a
Merkle Trade,"Merkle Trade is a decentralized trading platform that offers crypto, forex and commodities trading with leverage up to 1,000x, along with simplified UX and gamified trading features. Merkle Trade is built on the Aptos blockchain for its top-notch performance and scalability, and powered by LayerZero for asset bridging.","['1. Visit the Merkle Trade dashboard.', '2. Connect your EVM or Aptos wallet.', '3. You will need some USDC. You can get it from Binance.', '4. Now go to “Trade”, deposit some USDC and make trades.', '5. You will start earning points based on the volume of each trade and the fee rate for the trading pair.', '6. The points will be converted to MKL tokens after each season, which can be claimed later after TGE.', '7. Go to “Earn” and deposit USDC to earn more MKL.', '8. Refer your friends to earn rebates in USDC.', '9. For more information regarding the campaign, see this page.']",n/a,Airdrop Confirmed,aptos,n/a,0,https://merkle.trade/,MKL,"100,000,000 MKL",n/a,https://airdrops.io/wp-content/uploads/2024/07/Merkle-Trade-logo.png,n/a,https://t.me/merkle_trade_official,n/a,https://discord.gg/uV2A5nSpng,https://airdrops.io/visit/9kr2/,n/a,n/a,n/a,n/a,n/a,n/a,n/a
PancakeSwap,"PancakeSwap is a decentralised exchange available on multiple chains. As part of zkSync's airdrop #1, PancakeSwap received just over 2.4 million ZK tokens.","['1. Head to PancakeSwap, connect your wallet and ensure you’re on the zkSync Era network.', '2. Go to “Swap”. Regularly swap between tokens on zkSync for a chance to earn ZK.', '3. Go to “Liquidity” and provide liquidity. Most of the ZK tokens will be allocated to liquidity providers.', '4. veCAKE holders and past users have until August 5, 2024 (10:30 UTC) to claim their ZK tokens. To claim ZK rewards, visit PancakeSwap and a claim window will be shown.', '5. See this official announcement for more details.']",n/a,Airdrop Confirmed,zksync,n/a,0,https://pancakeswap.finance/v4,ZK,n/a,n/a,https://airdrops.io/wp-content/uploads/2024/07/pancakeswap.jpg,n/a,https://t.me/pancakeswap,https://airdrops.io/visit/rkr2/,https://airdrops.io/visit/skr2/,https://airdrops.io/visit/qkr2/,n/a,n/a,https://github.com/pancakeswap/,n/a,https://airdrops.io/visit/rkr2/,n/a,n/a
IBX,"IBX is a Decentralized Trading Platform, offering a wide variety of pairs with leverage up to 20X. Their commitment is to ensure high liquidity, minimal fees, and a broad range of trading pairs solidifies the IBX OrderBook as a fundamental platform for traders seeking to maximize the benefits of DeFi.","['1. Visit the IBX website.', '2. Connect your wallet.', '3. Now trade on IBX to earn free IBX points.', '4. Visit the IBX Galxe Quest page.', '5. Sign in with your X, Discord account or your wallet address.', '6. Complete easy tasks to earn free points.', '7. The top 10 traders will receive up to $30,000 USDC plus an additional $2,000 USDC.', '8. Earning IBX points will make users eligible for their upcoming airdrop.', '9. Additionally, their partner, Orderly Network, is currently running a campaign where trading on any of their DEX platforms allows you to accumulate merits for their upcoming airdrop.', '10. You can also invite your friends to receive 10% of the transaction fees paid by your referees.']",n/a,Airdrop Confirmed,eth,n/a,0,https://ibx.exchange/,ARTIC,"1,000,000,000 ARTIC",n/a,https://airdrops.io/wp-content/uploads/2024/07/ePJH_64t_400x400.jpg,n/a,n/a,n/a,https://discord.gg/ibxtrade,https://airdrops.io/visit/chr2/,n/a,n/a,n/a,n/a,n/a,n/a,n/a
Texture,"Texture P2P Lending protocol on Solana enables users to borrow and lend tokens directly between each other, using tokens as collateral for a fixed period of 7 days. The protocol doesn’t rely on any oracles in its design, meaning that lenders decide on how much risk (LTV) they are willing to take and are responsible for monitoring and adjusting their positions.","['1. Visit the Texture dashboard.', '2. Connect your Solana wallet.', '3. You will need some SOL and/or other tokens on Solana. You can get them from Binance.', '4. Now go to “Lend” and lend tokens.', '5. Also, go to “Borrow” and borrow tokens.', '6. You will start earning PXLS points every time you borrow or lend on Texture.', '7. Also, get 10% of the points from each referral.', '8. They don’t have their token yet but is very likely to launch one in the future.', '9. Users who collect PXLS points will likely get an airdrop if their token goes live.']",n/a,Airdrop Unconfirmed,solana,n/a,0,https://texture.finance/,N/A,n/a,n/a,https://airdrops.io/wp-content/uploads/2024/07/Texture-logo.jpg,n/a,n/a,n/a,https://discord.gg/6YvjpXzsqp,https://airdrops.io/visit/0fr2/,n/a,n/a,n/a,n/a,n/a,n/a,n/a
VaultCraft,"VaultCraft is an on-chain, permissionless protocol where anyone can spin up a vault — an automated asset strategy that optimizes returns on user-deposited funds.","['1. Visit the Smart Vaults page.', '2. Connect your wallet.', '3. You need some USDT, USDC or WETH in your wallet. If you don’t have any, get them on Binance.', '4. Now you can deposit the tokens in the various smart vaults to earn free XP.', '5. Now visit the VaultCraft campaign page.', '6. Mint a VAULTRON NFT.', '7. Complete on-chain and off-chain activities to earn more XP.', '8. In this second season, participants can earn free XP by providing and locking liquidity in the VCX/WETH Balancer Pool, depositing into L2 Smart Vaults, and exercising oVCX on L2’s.', '9. VaultCraft will airdrop Vaultron NFT holders based on their accumulated XP.', '10. Airdrops will happen every 90 days for 4 periods, which can be extended by protocol governance.', '11. Users can also earn Eigenlayer points and LRT points depending on which vault they deposit into or create themselves.', '12. You can also invite your friends to earn more XP.', '13. For more information about the airdrop, visit this official announcement.', '14. VaultCraft is also running an Immunefi Bug bounty campaign with up to $150,000 in rewards.']",n/a,Airdrop Confirmed,eth,n/a,0,http://www.vaultcraft.io/,VCX,n/a,n/a,https://airdrops.io/wp-content/uploads/2024/07/hSj1vwyf_400x400.jpg,n/a,https://t.me/vaultcraft,n/a,https://airdrops.io/visit/mhr2/,https://airdrops.io/visit/lhr2/,n/a,https://airdrops.io/visit/nhr2/,n/a,n/a,n/a,https://airdrops.io/goto/binance/,n/a
Lavarage,Lavarage is Solana's premier platform for leverage trading meme coins. They officially unveiled their platform at Solana Summit. Lavarage is also audited by the top 5 auditors of Code4rena.,"['1. Visit the Lavarage website.', '2. Connect your wallet.', '3. You can earn free Tephra for leverage trading.', '4. You will earn Tephra based on the size of your leveraged positions.', '5. Additionally, you can also earn free Tephra for completing the Zealy quests.', '6. Each XP earned on Zealy is equal to one Tephra.', '7. There’s also an off-chain points system on Discord, which is weighted the same as points earned by trading on the Lavarage platform.', '8. They also have their own NFT collection, called Lava Rock. Holding one of these NFTs could be a potential multiplier for their airdrop.', '9. You can also invite your friends to earn more points.', '10. Read the official document for more details about the points campaign.']",n/a,Airdrop Unconfirmed,SOL,n/a,0,https://lavarage.xyz/,LAVA,n/a,n/a,https://airdrops.io/wp-content/uploads/2024/06/JizyLres_400x400.jpg,n/a,n/a,n/a,n/a,https://airdrops.io/visit/pmq2/,n/a,n/a,n/a,n/a,n/a,n/a,n/a
Swords & Dungeons,"Swords & Dungeons is a massively multiplayer online MMORPG that is fun to play, durable, and highly social, which are the most prominent features of SND. You can level up characters, forge equipment, cultivate minions, recruit companions, trade freely, team up for battles, join guilds, and participate in various time-limited events.","['1. Visit the Swords & Dungeons Lucky Wheel Campaign page.', '2. Connect your wallet and Discord account.', '3. Spin the wheel to earn free XP and other rewards.', '4. Check in daily to earn 200 XP.', '5. Visit their Zealy quest page.', '6. Sign up and complete various tasks to earn free XP.', '7. Invite friends to earn more XPs.', '8. They’ll also be launching a battle pass NFT on July 23rd, which will activate exclusive missions.', '9. 5,000,000 GOLD tokens are assigned for this airdrop round.']","5,000,000 GOLD",Airdrop Confirmed,eth,n/a,0,https://swnd.io/entry,GOLD,"1,000,000,000 GOLD",https://airdrops.io/visit/fgr2/,https://airdrops.io/wp-content/uploads/2024/07/rKrtDY1K_400x400.jpg,n/a,n/a,n/a,https://discord.gg/swnd,https://twitter.com/SwordsnDungeons,n/a,n/a,n/a,n/a,n/a,n/a,https://www.youtube.com/embed/RK3rFPJ9vr8?feature=oembed
Macaron,"Macaron is a DEX built on Bitlayer, offering the most seamless trading experience and competitive yield-making schemes for users. Macaron goes beyond a DEX, but more a collection of yield-generating tools for users including liquidity farming, staking incentives, trade-to-earn and their special community-driven Point & Airdrop program to make their users win big.","['1. Visit the Macaron airdrop page.', '2. Connect your wallet and change the network to Bitlayer.', '3. Now click on “Verify” and verify your wallet.', '4. Then, connect your Twitter and follow them.', '5. Now, enter the invite code “cdeb5” to join the campaign.', '6. You will get 600 social points.', '7. Complete other social tasks to earn more social points.', '8. Now, make trades and provide liquidity on Macaron to earn DeFi points.', '9. You can use the Bitlayer bridge to bridge assets from other chains to Bitlayer.', '10. Also, get 15% of the points from each referral.', '11. All the earned points will be converted to Macaron tokens after TGE.', '12. For more information regarding the airdrop, see this Medium article.']",n/a,Airdrop Confirmed,Bitlayer,n/a,0,https://www.macaron.xyz/,N/A,n/a,n/a,https://airdrops.io/wp-content/uploads/2024/07/Macaron-logo.png,n/a,https://macarondex.medium.com/,n/a,https://airdrops.io/visit/7dr2/,https://airdrops.io/visit/6dr2/,n/a,n/a,https://github.com/Macaromswap,n/a,n/a,n/a,n/a
Clone,"Clone is trying to elevate Solana's DeFi ecosystem by introducing scalable, efficient markets for non-native assets. They aim to enrich the Solana blockchain with an expansive range of on-chain assets.","['1. Visit the Clone website.', '2. Click on “Trade” and connect your wallet.', '3. Enter our referral code “002056“.', '4. Now trade the different assets on Clone to earn free points.', '5. You can also provide liquidity to the protocol.', '6. Also, participate in their Zealy campaign to earn free XP.', '7. Refer friends and earn 10% of their trading and liquidity points', '8. Go to “Points” to obtain your referral link.', '9. They don’t have a token yet, but might launch one in the future.', '10. Users who interact with the platform may get an airdrop if they launch their token.', '11. Please note that there is no guarantee that they will do an airdrop to early users or launch their own token. It’s only speculation.']",n/a,Airdrop Unconfirmed,solana,n/a,0,https://clone.so/,CLONE,n/a,https://airdrops.io/visit/uar2/,https://airdrops.io/wp-content/uploads/2024/07/CN3AZ8Ft_400x400.jpg,n/a,n/a,n/a,https://discord.gg/BXAeVWdmmD,https://twitter.com/CloneProtocol,n/a,n/a,n/a,n/a,n/a,n/a,n/a
Symbiotic,"Symbiotic is a shared security protocol that serves as a thin coordination layer, empowering network builders to control and adapt their own (re)staking implementation in a permissionless manner.","['1. Visit the Symbiotic website.', '2. Connect your wallet.', '3. Now restake various assets on Symbiotic.', '4. They don’t have a token or points system yet.', '5. Users who interact with the platform may get an airdrop if they launch their token.', '6. Please note that there is no guarantee that they will do an airdrop to early users or launch their own token. It’s only speculation.']",n/a,Airdrop Unconfirmed,eth,n/a,0,https://symbiotic.fi/,SYM,n/a,n/a,https://airdrops.io/wp-content/uploads/2024/07/ouo922Aq_400x400.png,n/a,n/a,n/a,n/a,https://airdrops.io/visit/qcr2/,n/a,n/a,n/a,n/a,n/a,n/a,n/a
SuperBoring,"SuperBoring is a powerful streaming DEX that allows you to DCA between any two tokens, powered by Superfluid. It pays out more frequently than any other service without charging for gas.","['1. Visit the SuperBoring website.', '2. Connect your wallet.', '3. Switch the network to Base.', '4. They now have a referral campaign where users can earn a commission of BORING token by referring users to the platform.', '5. Go to the referral section to obtain your referral link.', '6. Also, interact with the platform by swapping tokens, which could potentially make you eligible for future airdrops.']",n/a,Airdrop Confirmed,base,n/a,0,https://superboring.xyz/,BORING,n/a,n/a,https://airdrops.io/wp-content/uploads/2024/07/M-_K497I_400x400.jpg,n/a,n/a,n/a,https://discord.gg/pPzPEDMVua,https://airdrops.io/visit/bar2/,n/a,n/a,https://github.com/superfluid-finance,n/a,n/a,n/a,n/a
Allora,"The Allora Network is designed to crowdsource financial alpha produced by machine learning models, powered by our Proof of Alpha consensus mechanism. It is a machine learning (ML) model network that is incentivized to contribute to the collective optimization of some underlying objective function.","['1. Visit the Allora Points campaign page.', '2. Connect your wallet.', '3. Participants can earn Allora Points through a variety of on-chain and off-chain activities.', '4. These include creating topics, bringing ML models, using Allora-powered applications, community engagement and participating in community events.', '5. They don’t have a token yet, but might launch one in the future.', '6. Users who interact with the platform may get an airdrop if they launch their token.', '7. Please note that there is no guarantee that they will do an airdrop to early users or launch their own token. It’s only speculation.']",n/a,Airdrop Unconfirmed,arbitrum,n/a,0,https://www.allora.network/,ALLO,n/a,https://airdrops.io/visit/xbr2/,https://airdrops.io/wp-content/uploads/2024/07/sDRnXVCd_400x400.jpg,n/a,n/a,n/a,https://airdrops.io/visit/2cr2/,https://airdrops.io/visit/1cr2/,n/a,n/a,https://github.com/allora-network,n/a,n/a,n/a,n/a
Amphor,"Amphor is an EVM-based yield aggregator tailored for the decentralized finance (DeFi) ecosystem. Amphor's primary objective is to offer web3 users seamless access to competitive and evolving DeFi yield strategies through a ""set and forget"" approach","['1. Visit the Amphor quest page.', '2. Enter our invite code and click “Enter.”', '3. Connect your wallet.', '4. Connect your X account.', '5. Complete easy social tasks to earn free points.', '6. You can also earn fee points by inviting your friends.', '7. They don’t have a token yet, but might launch one in the future.', '8. Users who interact with the platform may get an airdrop if they launch their token.', '9. Please note that there is no guarantee that they will do an airdrop to early users or launch their own token. It’s only speculation.']",n/a,Airdrop Unconfirmed,eth,n/a,0,https://amphor.io/,LRT,n/a,n/a,https://airdrops.io/wp-content/uploads/2024/07/3O0qQaEC_400x400.jpg,n/a,https://t.me/AmphorProtocol,n/a,n/a,https://twitter.com/Amphor_io,n/a,n/a,https://github.com/orgs/AmphorProtocol/repositories,n/a,n/a,n/a,n/a
ZKcandy,"ZKcandy is a Layer 2 scaling solution for Ethereum, utilizing zero-knowledge proofs to accelerate transaction speed and decrease fees.","['1. Visit the ZKcandy campaign page.', '2. Connect your wallet and complete easy social tasks.', '3. Go to the ZKcandy testnet page.', '4. Click on “Enter” and connect your wallet.', '5. Complete various testnet actions and tasks.', '6. People who complete testnet actions stand a chance to earn free ZK.', '7. The team has confirmed that 50% of the ZK allocation is set aside for testnet and mainnet incentives, social growth and social campaigns.', '8. For more details about the testnet actions, visit this official announcement.']",n/a,Airdrop Confirmed,zksync,n/a,0,https://zkcandy.io/,ZK,n/a,n/a,https://airdrops.io/wp-content/uploads/2024/07/NstRAv2v_400x400.jpg,n/a,https://t.me/zkcandy,n/a,https://airdrops.io/visit/59r2/,https://airdrops.io/visit/49r2/,n/a,n/a,n/a,n/a,n/a,n/a,n/a
Sunrise,"Sunrise is a specialized Data Availability (DA) Layer for Fee Abstraction and Proof of Liquidity, supporting the modular paradigm by allowing developers to build rollups/apps with enhanced security and liquidity.","['1. Visit the Sunrise Incentivized Testnet page.', '2. Connect your wallet.', '3. To access the testnet and testnet faucet, you must connect two separate wallets. One should be an EVM wallet and second should be a Cosmos wallet.', '4. Your EVM wallet must have at least one transaction sent history and at least 0.001 ETH on the Ethereum Mainnet.', '5. Now complete testnet actions daily, including claiming, swapping, providing liquidity and participating in governance.', '6. You can also refer your friends to earn points for each referral. The referee must complete a certain number of testnet tasks.', '7. Testnet users who collect the points will be eligible for wave 4 of the RISE airdrop.', '8. For more information about the airdrop, visit this official announcement.']",n/a,Airdrop Confirmed,ownchain,n/a,0,http://sunriselayer.io/,RISE,"1,000,000,000 RISE",n/a,https://airdrops.io/wp-content/uploads/2024/07/eFcRdi36_400x400.jpg,n/a,n/a,n/a,https://discord.gg/sunrise,https://airdrops.io/visit/j7r2/,n/a,n/a,https://github.com/sunriselayer,n/a,n/a,n/a,n/a
Napier Finance,"Napier is a useful tool for a diverse set of actors within the DeFi space. If you have exposure to any yield in DeFi, using Napier allows you to always choose the best practices, regardless of market conditions, such as fixed rate, upfront yield, yield trading and liquidity provision.","['1. Visit the Napier Finance points page.', '2. Connect your wallet.', '3. You can now complete quests to earn free Napier points.', '4. Users can earn Napier points as well as CRV/CVX emissions and EigenLayer/LRT points.', '5. You can check your Napier points from here.', '6. Additionally, you can earn more points by inviting your friends.', '7. Both the inviter and invitee can earn 100 Napier Points per invitation.', '8. The team has confirmed that the points represent the right to receive NPR tokens after TGE.']",n/a,Airdrop Confirmed,Curve,n/a,0,https://napier.finance/,NPR,n/a,n/a,https://airdrops.io/wp-content/uploads/2024/07/uUmS2hoy_400x400.jpg,n/a,https://t.me/napierfi,n/a,https://discord.gg/Ju82Zm7aXz,https://twitter.com/NapierFinance,n/a,n/a,n/a,n/a,n/a,n/a,n/a
Injera,"Injera is a synthetic dollar protocol built on Injective that provides a crypto-native solution for money not reliant on traditional banking system infrastructure, alongside a globally accessible dollar denominated instrument.","['1. Visit the Injera website.', '2. Enter our invite code “XMFRVK.”', '3. Connect your wallet.', '4. Participants can earn GEM by depositing, borrowing and farming.', '5. Injective Ecosystem Holder:\nhINJ stakers of Injera money market will earn GEM emissions at 1x multiplier.\nnINJ stakers of Injera money market will earn GEM emissions at 1x multiplier.\ndINJ stakers of Injera money market will earn GEM emissions at 2x multiplier.', '6. hINJ stakers of Injera money market will earn GEM emissions at 1x multiplier.', '7. nINJ stakers of Injera money market will earn GEM emissions at 1x multiplier.', '8. dINJ stakers of Injera money market will earn GEM emissions at 2x multiplier.', '9. Injera Protocol user:\nA portion of GEM will be distributed to USDi stakers.\nA portion of $GEM will be distributed to Helix Grid Trading Bot.', '10. A portion of GEM will be distributed to USDi stakers.', '11. A portion of $GEM will be distributed to Helix Grid Trading Bot.', '12. Visit this official airdrop announcement to find out all the ways to earn GEM.', '13. They have confirmed an airdrop after ERA TGE.', '14. Earning more GEM will help you earn a larger allocation of ERA.']",n/a,Airdrop Unconfirmed,Injective,n/a,0,https://injera.io/,ERA,n/a,https://airdrops.io/visit/crq2/,https://airdrops.io/wp-content/uploads/2024/06/IgRRmKNG_400x400.jpg,n/a,https://t.me/injeraofficial/,n/a,n/a,https://airdrops.io/visit/drq2/,n/a,n/a,n/a,n/a,n/a,n/a,n/a
Super Champs,"The Super Champs Universe is a gaming and animation universe with a motley mix of young athletes from far-flung places like Brontokyo, Nimbleton, Wispwood, and Zomberg.","['1. Visit the Super Champs Rewards Program', '2. Sign up for the Rewards Program by connecting your Metamask and following the registration process', '3. You can now complete various quests on the dashboard', '4. Quests include social, gameplay, invite-based tasks and you can earn Quest Points on completion of the task and claim them from the dashboard', '5. Quests are categorized Seasonal Quests, Special Limited Time Quests and Daily Quests', '6. You can earn more points by holding the Genesis NFT from the Super Champs: Racket Rampage Genesis Collection', '7. At the end of the season, use your quest points to compete for CHAMP tokens']",n/a,Airdrop Confirmed,base,n/a,0,https://www.superchamps.com/,CHAMP,n/a,https://airdrops.io/visit/06r2/,https://airdrops.io/wp-content/uploads/2024/07/YWdgH_IY_400x400.jpg,n/a,n/a,n/a,https://discord.gg/superchamps,https://airdrops.io/visit/16r2/,n/a,n/a,n/a,n/a,n/a,n/a,n/a
