Title,Features,Guide,Total_Value,Status,Platform,Requirements,Num_Of_Prev_Drops,Website,Ticker,Total_Supply,Whitepaper,Thumbnail,Facebook,Telegram Group,Telegram Channel,Discord,Twitter,Medium,CoinGecko,GitHub,Coinmarketcap,Reddit,Exchanges,Youtube
Quasar,"Quasar is a decentralized appchain enabling interchain digital asset management. A digital asset can be anything from digital certificates, authentication codes, to fungible or non-fungible tokens. Management can be anything one would like to do with the digital asset such as save, co-manage, crowdsource, or crowdlend. Quasar offers a transparent, secure, and governable platform to build general purpose management containers (vaults).","['1. Visit the Quasar mainnet page.', '2. Connect your Keplr wallet.', '3. Click on “Explore vault”.', '4. Now click on “Bond” and bond the tokens.', '5. Try to bond multiple times.', '6. They’ve confirmed to do an airdrop to early testnet users so early mainnet users could also get an airdrop when they launch their token.', '7. Please note that there is no guarantee that they will do an airdrop to early users. It’s only speculation.']",n/a,Airdrop Unconfirmed,ownchain,n/a,0,https://www.quasar.fi/,QSR,n/a,https://airdrops.io/visit/tpi2/,https://airdrops.io/wp-content/uploads/2023/03/Quasar-logo.png,n/a,https://t.me/quasarfi,n/a,https://airdrops.io/visit/upi2/,https://twitter.com/QuasarFi,n/a,n/a,n/a,n/a,n/a,n/a,n/a
Dune Analytics,"Dune Analytics is a powerful tool for blockchain research, complete with all the tools you need to discover, explore, and visualize vast amounts of blockchain data. It allows anyone with at least a little bit of SQL, Ethereum Virtual Machine, and Business knowledge to analyze blockchain data in interesting ways.","['1. Visit the Dune Analytics website.', '2. Create an account.', '3. Verify your mail.', '4. Go to your profile and add a wallet address.', '5. Now create a new query or copy the code of an existing query from one of the available queries and save it.', '6. They don’t have an own token yet but it’s very likely that they would launch an own token in the future.', '7. Early users who’ve signed up and created queries may become eligible for an airdrop if they launch an own token.', '8. Please note that there is no guarantee that they will do an airdrop to early users or will launch an own token. It’s only speculation.']",n/a,Airdrop Unconfirmed,eth,E-Mail,0,https://dune.com/,N/A,n/a,https://airdrops.io/visit/6mi2/,https://airdrops.io/wp-content/uploads/2023/03/Dune-Analytics-logo.png,n/a,n/a,n/a,https://airdrops.io/visit/7mi2/,https://twitter.com/DuneAnalytics,n/a,n/a,https://github.com/duneanalytics/docs,n/a,n/a,n/a,n/a
SPACE ID,"SPACE ID is building a universal name service network with a one-stop identity platform to discover, register, trade, manage web3 domains. It also includes a Web3 Name SDK & API for developers across blockchains and provides a multi-chain name service for everyone to easily build and create a web3 identity.","['1. Visit the SPACE ID website.', '2. Connect your BSC wallet.', '3. Now click on “Voyage Airdrop” from the top.', '4. You will see the number of tokens you’re eligible to claim.', '5. Click on “Claim” and claim your tokens.', '6. Now select a delegator or delegate it to yourself to claim the tokens.', '7. Users who registered a .bnb or .arb domain after March 10th, invited new users to register a .bnb/.arb domain, or held blue chip NFTs and ENS domains have received Voyage boxes which had points based on the rarity of the box.', '8. Your accumulated points will determine the number of tokens you can claim.', '9. You can claim the tokens until  July 29th, thereafter it will be returned to the airdrop pool for future rewards.', '10. For more information regarding Voyage season 2, see this page and for information regarding the airdrop, read this article.', '11. ', '12. ', '13. ', '14. ', '15. ', '16. ', '17. ', '18. ', '19. ', '20. ', '21. ', '22. ', '23. ', '24. ', '25. ', '26. ', '27. ', '28. ', '29. ', '30. ', '31. ', '32. ', '33. ', '34. ', '35. ', '36. ', '37. ', '38. ', '39. ', '40. ']","22,482,583 ID",Expired,Binance Smart Chain,n/a,2,https://space.id/,ID,"2,000,000,000 ID",https://airdrops.io/visit/qli2/,https://airdrops.io/wp-content/uploads/2023/03/SPACE-ID-logo.jpg,n/a,n/a,n/a,https://discord.gg/spaceid,https://twitter.com/SpaceIDProtocol,n/a,https://airdrops.io/visit/0ui2/,n/a,https://airdrops.io/visit/xti2/,n/a,"https://airdrops.io/goto/binance/, https://airdrops.io/visit/alx1/, https://airdrops.io/goto/kucoin/, https://airdrops.io/goto/okex/, https://airdrops.io/goto/poloniex/, https://airdrops.io/visit/sx22/",n/a
AlienSwap,"AlienSwap is a TOP 5 NFT marketplace and aggregator on Ethereum. They're trying to bring community e-commerce gameplay to NFT, to open up several million new users to NFT eco.","['1. Visit the AlienSwap website.', '2. Connect your Ethereum wallet.', '3. Now Buy or Sell NFTs on the platform.', '4. They’ve confirmed to launch their own token called “ALIEN”.', '5. Early users who’ve bought or sold NFTs on the platform may get an airdrop once they launch their token.', '6. Please note that there is no guarantee that they will do an airdrop to early users. It’s only speculation.']",n/a,Airdrop Unconfirmed,eth,n/a,0,https://alienswap.xyz/,ALIEN,n/a,n/a,https://airdrops.io/wp-content/uploads/2023/02/AlienSwaplogo.jpg,n/a,n/a,n/a,https://discord.gg/6SzkW9hNRa,https://twitter.com/AlienSwap_NFT,n/a,n/a,n/a,n/a,n/a,n/a,n/a
Nexon Finance,Nexon is a community-built permission-less Lending protocol on zkSync. This would enable anyone including new & existing Projects/DAOs to create their own lending pools.,"['1. Visit the Nexon Finance testnet page.', '2. Connect your zkSync wallet.', '3. Now click on “Wrong network” to change the network to zkSync testnet.', '4. Claim zkSync testnet token from here.', '5. Cick on “Claim tokens” from Nexon Finance testnet page to get testnet tokens.', '6. Now click on “Tweet & Proceed” to enter the testnet page.', '7. Now select an asset and supply and borrow tokens.', '8. They don’t have an own token yet so early testnet participants may become eligible for an airdrop if they launch an own token.', '9. Please note that there is no guarantee that they will do an airdrop and that they will launch their own token. It’s only speculation.']",n/a,Expired,zkSync,n/a,0,https://www.nexon.finance/,N/A,n/a,https://airdrops.io/visit/cei2/,https://airdrops.io/wp-content/uploads/2023/02/Nexon-Financelogo.jpg,n/a,n/a,n/a,https://airdrops.io/visit/mdi2/,https://twitter.com/NexonFi,n/a,n/a,https://github.com/nexon-finance,n/a,n/a,n/a,n/a
EZ Finance,EZ Finance brings users an innovative and exciting farming experience on Aptos and Sui. EZ Finance provides features including Leverage farming + Hedge farming + Farming aggregator + lending.,"['1. Visit the EZ Finance website.', '2. Connect your Aptos wallet.', '3. Get testnet APT from this faucet.', '4. Click on the Faucet tab on the EZ Finance website and claim testnet tokens.', '5. Now click on “Farm” and supply tokens.', '6. Click on “Lend” and lend tokens.', '7. Also try to do their Crew3 tasks.', '8. They’ve confirmed to launch an own token called “EZM” and early users who’ve done testnet actions may get an airdrop when they launch their token.', '9. Please note that there is no guarantee that they will do an airdrop. It’s only speculation.']",n/a,Expired,Aptos,n/a,0,https://ezfinance.app/home,N/A,n/a,n/a,https://airdrops.io/wp-content/uploads/2023/02/EZ-Finance-logo.jpg,n/a,n/a,n/a,n/a,https://twitter.com/EZProtocol,n/a,n/a,n/a,n/a,n/a,n/a,n/a
Olive,"Olive is a multi-chain protocol that is primarily known for combining composability with structured products to amplify base yields by up to ~1.5X without exposing users' funds to principal or credit risks. Olive has a vault structure, which abstracts away all of the complexities of structured products, such as underwriting, pricing, juggling strike prices and rollover. Instead, users have to deposit assets in their favored strategy, and Olive's auto-compounding vaults take care of the rest.","['1. Visit the Olive website.', '2. Connect your wallet.', '3. Now select a vault and stake your tokens.', '4. You will start earning yield on your tokens.', '5. They’ve confirmed to launch an own token called “OLIVE” in the future. Early users who’ve deposited into their vaults may become eligible for an airdrop once they launch their token.', '6. Please note that there is no guarantee that they will do an airdrop. It’s only speculation.']",n/a,Airdrop Unconfirmed,eth,n/a,0,https://oliveapp.finance/,OLIVE,"999,999,999 OLIVE",https://airdrops.io/visit/s9i2/,https://airdrops.io/wp-content/uploads/2023/02/Olive-logo.png,n/a,https://t.me/OxOlive,n/a,https://discord.gg/0xOlive,https://twitter.com/0xOlive,n/a,n/a,n/a,n/a,n/a,n/a,n/a
Enchanter Finance,"Enchanter Finance aims to build the first ever Social Trading AMM DEX on Aptos. They also serve to be the entry point for all on-chain assets across Move-based ecosystems. On top of trading and yield farming, Enchanter Finance will provide secure DeFi alternatives that will help traders and liquidity providers better manage their assets.","['1. Visit the Enchanter Finance testnet page.', '2. Connect your Aptos wallet.', '3. Get some testnet APTOS from here.', '4. Now make some swaps and provide liquidity to the platform.', '5. Also try out their Sui testnet page.', '6. They’ve already confirmed to launch an own token called “ENT”. Early users who’ve done testnet actions may get an airdrop once they launch their token.', '7. Please note that there is no guarantee that they will do an airdrop. It’s only speculation.']",n/a,Airdrop Unconfirmed,Aptos,n/a,0,https://www.enchanter.fi/,ENT,"100,000,000 ENT",n/a,https://airdrops.io/wp-content/uploads/2023/02/Enchanter-Finance-logo1.png,n/a,n/a,n/a,https://airdrops.io/visit/67i2/,https://twitter.com/EnchanterFi,n/a,n/a,n/a,n/a,n/a,n/a,n/a
Mayan,Mayan is a cross-chain swap auction protocol with the goal of offering the best possible swap rates on Solana for any trade. Mayan Swap is the implementation of Mayan protocol through set of trustless and permissionless smart contracts.,"['1. Visit the Mayan website.', '2. Connect your Solana, Ethereum, Avalanche or BSC wallet.', '3. Now make swaps on the platform.', '4. Also try to do Mayan Guild tasks.', '5. Early users who’ve made swaps on the platform may get an airdrop if they launch an own token.', '6. Please note that there is no guarantee that they will do an airdrop and that they will launch their own token. It’s only speculation.']",n/a,Airdrop Unconfirmed,Solana,n/a,0,https://mayan.finance/,N/A,n/a,https://airdrops.io/visit/p5i2/,https://airdrops.io/wp-content/uploads/2023/01/Mayan-logo.jpg,n/a,n/a,n/a,https://airdrops.io/visit/q5i2/,https://twitter.com/MayanFinance,n/a,n/a,https://github.com/mayan-finance,n/a,n/a,n/a,n/a
Neptune Mutual,"Neptune Mutual is a blockchain cover protocol that safeguards the Ethereum community from cyber threats to contemporary financial products. Just like the traditional parametric insurance products, Neptune Mutual cover pools provide guaranteed payouts upon triggering a set of the predefined event(s). These predefined events are also known as cover parameters. Cover parameters consist of rules and exclusions. Payouts can only occur when all cover conditions are met and no exclusions are present. The term cover incident refers to a state in which all cover rules and exclusions have been met.","['1. Visit the Neptune Mutual website.', '2. Connect your wallet.', '3. Now select an exchange or protocol you want to get covered.', '4. Enter the amount of protection you need and the coverage period and then buy the policy.', '5. Also select an exchange or protocol and try to provide liquidity.', '6. They’ve confirmed to launch an own token called “NPM”. Early users who have bought insurance or provided liquidity may get an airdrop when they launch their token.', '7. Please note that there is no guarantee that they will do an airdrop. It’s only speculation.']",n/a,Airdrop Unconfirmed,eth,n/a,0,https://neptunemutual.com/,NPM,n/a,https://airdrops.io/visit/ewh2/,https://airdrops.io/wp-content/uploads/2023/01/Neptune-Mutual-logo.jpg,n/a,n/a,https://t.me/neptunemutual,https://airdrops.io/visit/fwh2/,https://twitter.com/neptunemutual,n/a,n/a,https://github.com/neptune-mutual-blue,n/a,https://airdrops.io/visit/gwh2/,n/a,https://www.youtube.com/embed/GeqjuV1u4UI?feature=oembed
Demex,"Demex is a decentralized trading platform that supports advanced crypto derivatives. It enables the trading of sophisticated financial instruments such as futures, perpetuals and more. Built on Carbon, a custom layer-2 blockchain solution, Demex is designed for speed, scalability, and security all while providing an intuitive user experience.","['1. Visit the Demex website.', '2. Connect your Cosmos or Ethereum wallet.', '3. Demex is built on Carbon Protocol and “SWTH” is the governance token of Carbon Protocol. You will need “SWTH” to pay for the fees on the platform. You can get “SWTH” on Uniswap or Gate.io.', '4. Now, make trades on the platform, provide liquidity and more.', '5. You will get points for interacting with the platform.', '6. Points may be converted to Demex tokens at launch if they launch their own token.', '7. Please note that there is no guarantee that they will do an airdrop and that they will launch their own token. It’s only speculation.']",n/a,Airdrop Unconfirmed,Carbon Protocol,n/a,0,https://dem.exchange/,N/A,n/a,https://airdrops.io/visit/8vh2/,https://airdrops.io/wp-content/uploads/2023/01/Demex-logo.jpg,n/a,n/a,n/a,https://discord.gg/SPh62Hf,https://twitter.com/demexchange,n/a,n/a,https://github.com/Switcheo/carbon-js-sdk,n/a,n/a,n/a,n/a
Specular,"Specular is the first EVM-native optimistic rollup, and provides stronger security and decentralization properties than existing optimistic rollup solutions. Specular is fully compatible with the EVM, and achieves minimal trusted computing base, improving security, auditability and upgradeability, support for permissionless, trust-minimized participation of multiple Ethereum clients, enabling client diversity; and efficient dispute resolution.","['1. Visit the Specular testnet page.', '2. Connect your Metamask wallet and change the network to Specular testnet.', '3. Visit the Specular faucet page and request test ETH.', '4. Go back to the testnet page and mint WETH.', '5. Now swap WETH for ERCA or ERCB.', '6. They don’t have an own token yet but could launch one in the future. Early users who’ve done testnet actions may get an airdrop if they launch their token.', '7. Please note that there is no guarantee that they will do an airdrop and that they will launch their own token. It’s only speculation.']",n/a,Airdrop Unconfirmed,eth,n/a,0,https://specular.network/,N/A,n/a,https://airdrops.io/visit/koh2/,https://airdrops.io/wp-content/uploads/2023/01/Specular-logo.jpg,n/a,n/a,n/a,n/a,https://twitter.com/SpecularL2,n/a,n/a,n/a,n/a,n/a,n/a,n/a
Hashstack,"Hashstack is a permissionless and decentralized zk-native money market protocol enabling undercollateralized borrowing. Hashstack allows users to borrow up to 3 times the collateral amount, which is not offered by any other lending platforms.","['1. Visit the Hashstack website.', '2. Connect or set up Braavos Wallet or any Starknet wallets.', '3. Now, go to the dashboard and supply tokens.', '4. Also, try to borrow some tokens.', '5. Go to “Stake” and stake some tokens.', '6. You will earn points for interacting on the platform.', '7. They don’t have their own token yet but has hinted at launching one in the future. Early users who interact with the platform and earn points would likely get an airdrop when their token goes live.', '8. Please note that there is no guarantee that they will do an airdrop and that they will launch their own token. It’s only speculation.']",n/a,Airdrop Unconfirmed,StarkNet,n/a,0,https://hashstack.finance/,N/A,n/a,https://airdrops.io/visit/7nh2/,https://airdrops.io/wp-content/uploads/2023/01/Hashstack-logo.jpg,n/a,n/a,n/a,https://discord.gg/hashstack-community-907151419650482217,https://twitter.com/0xHashstack,n/a,n/a,n/a,n/a,https://airdrops.io/visit/8nh2/,n/a,n/a
Brine,"Brine Finance is a crosschain orderbook DEX that aims to improve the trading experience for users by providing an instant, gasless, trustless and secure platform for crypto trading.","['1. Visit the Brine mainnet page.', '2. Connect your Ethereum wallet.', '3. Now, make trades on the platform.', '4. They’ve hinted at launching their own token called SALT and also hinted at doing an airdrop to early users.', '5. Early users who trade on the platform may get an airdrop when their token goes live.', '6. Please note that there is no guarantee that they will do an airdrop and that they will launch their own token. It’s only speculation.', '7. Visit the Brine testnet page.', '8. Connect your wallet.', '9. Now, change the network to Goerli.', '10. Get testnet ETH from here.', '11. Now go back to Brine, click on “Wallet” and claim test tokens.', '12. Now deposit USDC.', '13. Click on “Trade” and make trades.', '14. They’ve hinted at launching their own token and doing an airdrop to early users. Early users who’ve done testnet actions may get an airdrop once they launch their own token.', '15. Please note that there is no guarantee that they will do an airdrop and that they will launch their own token. It’s only speculation.']",n/a,Airdrop Unconfirmed,eth,n/a,0,https://www.brine.finance/,N/A,n/a,n/a,https://airdrops.io/wp-content/uploads/2022/12/Brine-logo.jpg,n/a,n/a,n/a,https://discord.gg/wuPHBr9e9y,https://twitter.com/BrineFinance,n/a,n/a,n/a,n/a,n/a,n/a,https://www.youtube.com/embed/xav4R5Bod3A?feature=oembed
V2X,V2X is a the next generation of perpetual DEX. They're a team of DeFi believers whose goal is to create an effective replacement for centralized entities that negate the sustainability of the Crypto Market.,"['1. Visit the V2X testnet page.', '2. Connect your Arbitrum wallet.', '3. Change the network to Arbitrum Goerli.', '4. Firstly get some testnet ETH for the Ethereum Goerli network from here and bridge it to Arbitrum from here.', '5. Go back to V2X and click on “Getmock-USD for trading” to get mock USD.', '6. Now make trades on the platform.', '7. They don’t have an own token yet but could launch one in the future. Early users who’ve done testnet actions may get an airdrop if they launch their token.', '8. You can also thereby become eligible for the Arbitrum speculative airdrop.', '9. Please note that there is no guarantee that they will do an airdrop and that they will launch their own token. It’s only speculation.']",n/a,Expired,Arbitrum,n/a,0,https://v2x.gg/,N/A,n/a,n/a,https://airdrops.io/wp-content/uploads/2023/01/V2X-logo.jpg,n/a,n/a,n/a,https://airdrops.io/visit/mnh2/,https://twitter.com/V2X_GG,n/a,n/a,n/a,n/a,n/a,n/a,n/a
Supernova,"Supernova is the ‘Ultimate Platform for Staked Assets’. Their goal is to provide all the necessary components for the staked assets, starting with liquid staking. Supernova goes beyond just providing shadow tokens. Supernova shall enable auto-compounding and also let users to collateralize their shadow tokens to mint stablecoins in Gamma 2. They will also develop a swap called ‘Staked swap’ that is specifically designed for staked assets that will provide a fair swap experience.","['1. Visit the Supernova website.', '2. Connect your Keplr wallet.', '3. Now change the network to “Champagne” testnet.', '4. Now click on “Faucet” and get test tokens.', '5. Now make swaps, stake tokens and provide liquidity.', '6. They’ve confirmed to launch an own token called NOVA.', '7. Early users who’ve done testnet actions may get an airdrop once they launch their token.', '8. ATOM stakers may also get an airdrop once they launch their token.', '9. Please note that there is no guarantee that they will do an airdrop. It’s only speculation.']",n/a,Airdrop Unconfirmed,ownchain,n/a,0,https://www.supernovaprotocol.xyz/,NOVA,"200,000,000 NOVA",https://airdrops.io/visit/kkh2/,https://airdrops.io/wp-content/uploads/2022/12/Supernova-logo.jpg,n/a,n/a,n/a,https://discord.gg/2gj8fScWqD,https://twitter.com/Supernovazone,n/a,n/a,https://github.com/Carina-labs,n/a,n/a,n/a,n/a
Bebop,"Bebop is a decentralized trading platform that delivers a breakthrough in user experience for trading in DeFi. They offer multiple token trades, no slippage, and network fees included in the quoted price.","['1. Visit the Bebop website.', '2. Connect your Ethereum, Arbitrum, Binance Smart Chain or Polygon wallet.', '3. Now, make trades on the platform.', '4. Try to trade on all networks.', '5. Also, try to claim Bebop NFT badges on Noox.', '6. Bebop doesn’t have an own token yet but could launch one in the future. Early users who’ve traded on the platform may get an airdrop if they launch an own token.', '7. Please note that there is no guarantee that they will do an airdrop and that they will launch their own token. It’s only speculation.']",n/a,Airdrop Unconfirmed,eth,n/a,0,https://bebop.xyz/,N/A,n/a,n/a,https://airdrops.io/wp-content/uploads/2022/12/Bebop-logo.png,n/a,n/a,n/a,https://airdrops.io/visit/hgh2/,https://twitter.com/bebop_dex,n/a,n/a,n/a,n/a,n/a,n/a,n/a
Phi,"Phi is a whole new Web3 world created directly from ENS & wallet activities, enabling the easy visualization of on-chain identities. It encourages users to interact with various web3 protocols, which provides a positive feedback loop to the entire Crypto ecosystem.","['1. Visit the Phi quests page.', '2. Connect your Polygon wallet.', '3. You will need an ENS domain to start using Phi. You can get one from here.', '4. Now complete the simple quests.', '5. Also try out Phi Land.', '6. Early users who’ve done quests and tried out Phi land may get an airdrop if they launch an own token.', '7. Please note that there is no guarantee that they will do an airdrop and that they will launch their own token. It’s only speculation.']",n/a,Airdrop Unconfirmed,Polygon,n/a,0,https://philand.xyz/,N/A,n/a,https://airdrops.io/visit/fdh2/,https://airdrops.io/wp-content/uploads/2022/12/Phi-logo.jpg,n/a,n/a,n/a,https://discord.gg/phi,https://twitter.com/phi_xyz,n/a,n/a,https://github.com/PHI-LABS-INC,n/a,n/a,n/a,n/a
Swing,"Swing is cross-chain infrastructure for the internet. It is an interoperability protocol that unifies multi-chain liquidity to enable arbitrary cross-chain interactions across major EVM and non-EVM blockchains (Solana, Terra, Polkadot). It eliminates trusted intermediaries allowing for fast, efficient trading.","['1. Visit the Swing website.', '2. Connect your wallet.', '3. Select the chain and the token you want to send.', '4. Select the chain and the token you want to receive.', '5. Complete the swap.', '6. Swing has confirmed to launch an own token called “SWING” and has hinted at giving an allocation to the community.', '7. Early users who’ve made swaps on the platform may get an airdrop once they launch an own token.', '8. Please note that there is no guarantee that they will do an airdrop. It’s only speculation.']",n/a,Airdrop Unconfirmed,eth,n/a,0,https://swing.xyz/,SWING,"1,000,000,000 SWING",https://airdrops.io/visit/cbh2/,https://airdrops.io/wp-content/uploads/2022/12/Swing-logo.jpg,n/a,https://t.me/swingxyz,n/a,https://airdrops.io/visit/dbh2/,https://twitter.com/swing_xyz,n/a,n/a,n/a,n/a,n/a,n/a,n/a
Sentiment,"Sentiment is a liquidity protocol launching on Arbitrum. On Sentiment, borrowers access 5x leverage which can be deployed permissionlessly. Borrowers can use this leverage to long or short tokens or deploy assets into various other DeFi protocols that Sentiment is integrated with. Users can leverage into integrations such as AAVE, Curve, and Sushi, to increase their yield.","['1. Visit the Sentiment website.', '2. Connect your Arbitrum wallet.', '3. Now click on “Mint a margin wallet” to create your wallet.', '4. Go to your account and deposit assets.', '5. Now click on “Trade” and make swaps.', '6. Click on “Invest” and lend some tokens.', '7. Click on “Borrow” and borrow assets and repay.', '8.  Also use their “ETH Wrapper” feature to wrap or unwrap ETH.', '9. Early users who’ve traded on the platform may get an airdrop if they launch an own token.', '10. Please note that there is no guarantee that they will do an airdrop and that they will launch their own token. It’s only speculation.']",n/a,Airdrop Unconfirmed,Arbitrum,n/a,0,https://www.sentiment.xyz/,N/A,n/a,https://airdrops.io/visit/c7h2/,https://airdrops.io/wp-content/uploads/2022/11/Sentiment-logo.jpg,n/a,n/a,n/a,n/a,https://twitter.com/sentimentxyz,n/a,n/a,https://github.com/sentimentxyz,n/a,n/a,n/a,n/a
